Rate,Review
3,"Chất liệu: vải mỏng, nhẹ, mát mẻ. Kích cỡ: vừa người (1m67 - 72kg) Màu sắc: đúng mẫu, hình in đẹp nhưng ko biết có bền ko  Trừ 1* do mất 4 ngày mới xác nhận đơn và đóng gói."
3,"Chất liệu: vải mỏng, nhẹ, mát mẻ. Kích cỡ: vừa người (1m55 - 55kg) Màu sắc: đúng mẫu, hình in đẹp nhưng ko biết có bền ko  Trừ 1* do mất 4 ngày mới xác nhận đơn và đóng gói."
3,Đặt màu đen giao màu trắng. Buôn bán kiểu này không được đâu nha. Khó lòng giữ chân khách quay lại mua lần sau.
3,Chê nha thung xấu mỏng thôi tiền nào của đấy nên  không dám đòi hỏi nhiều.nhưng bảo tặng vòng tay là không thấy nha.CHÊ
3,kích thước không chuẩn... nhỏ quá mà không biết phải làm sao...
